{
  "eventId": "00000000-0000-4000-8000-000000000004",
  "eventType": "application.submitted",
  "schemaVersion": 1,
  "aggregateId": "00000000-0000-4000-8000-000000000001",
  "aggregateVersion": 0,
  "occurredAt": "2026-10-20T10:00:00.000Z",
  "payload": { "applicationId": "00000000-0000-4000-8000-000000000001" }
}
